id;date;title;link;label;label_score;cluster_id;matched_tags;source;snippet;content_clean
cafd791b2674a2b65e6b2ace9fabdee3924d9b9add0ba400dde78f7580c8deef;2025-10-26 15:15:53;Elkészült az új ötéves terv Kínában: az egész világot érinteni fogják a változások;https://privatbankar.hu/cikkek/makro/elkeszult-az-uj-oteves-terv-kinaban-az-egesz-vilagot-erinteni-fogjak-a-valtozasok.html?utm_source=rss&utm_medium=referral;kormánypárti;0.267;4;;https://privatbankar.hu/rss;"Kína a következő, 2026 és 2030 közötti ötéves terv időszakában tovább kívánja bővíteni gazdasági nyitását, különösen a szolgáltatási szektorban. &amp;nbsp;";"Kína a következő, 2026 és 2030 közötti ötéves terv időszakában tovább kívánja bővíteni gazdasági nyitását, különösen a szolgáltatási szektorban. &amp;nbsp;"
97f91800a97bd3ab6f167eac824906c05b5177c3f91a2c88930901b6f734bd26;2025-10-26 15:15:53;EU-csúcs: Zelenszkij a zárolt orosz vagyonokra pályázik;https://privatbankar.hu/cikkek/nemzetkozi/eu-csucs-zelenszkij-a-zarolt-orosz-vagyonokra-palyazik.html?utm_source=rss&utm_medium=referral;kormánypárti;0.359;4;;https://privatbankar.hu/rss;"Volodimir Zelenszkij ukrán elnök csütörtökön Brüsszelben az uniós tagállamok vezetőinek reményét fejezte ki, hogy az Európai Unió mielőbb politikai döntést hoz egy új, úgynevezett „jóvátételi hitel”&amp;nbsp;elindításáról, amelyet a zárolt orosz vagyonokból finanszíroznának Ukrajna támogatására. &amp;nbsp;";"Volodimir Zelenszkij ukrán elnök csütörtökön Brüsszelben az uniós tagállamok vezetőinek reményét fejezte ki, hogy az Európai Unió mielőbb politikai döntést hoz egy új, úgynevezett „jóvátételi hitel”&amp;nbsp;elindításáról, amelyet a zárolt orosz vagyonokból finanszíroznának Ukrajna támogatására. &amp;nbsp;"
f258a22f03a4a24285cc1c7eb740f2330d1e043281cf794e246b7d6f9498352f;2025-10-26 15:15:53;Bod Péter Ákos: lemaradunk a kaptatón – a magyar gazdaság nehéz évei;https://privatbankar.hu/cikkek/benchmark/bod-peter-akos-lemaradunk-a-kaptaton--a-magyar-gazdasag-nehez-evei.html?utm_source=rss&utm_medium=referral;kormánypárti;0.314;4;;https://privatbankar.hu/rss;"A „Németország a hibás” magyarázkodás komolytalan. A kisebb magyar lendület ország-specifikus okokra vezethető vissza, nem pedig a globális kereskedelmi vagy általános európai tényezőkre. A magyar gazdaság&amp;nbsp;a hozzá mérhető adottságú&amp;nbsp;országokból álló kelet-közép-európai térség növekedési nívója alatt teljesít.";"A „Németország a hibás” magyarázkodás komolytalan. A kisebb magyar lendület ország-specifikus okokra vezethető vissza, nem pedig a globális kereskedelmi vagy általános európai tényezőkre. A magyar gazdaság&amp;nbsp;a hozzá mérhető adottságú&amp;nbsp;országokból álló kelet-közép-európai térség növekedési nívója alatt teljesít."
48f1a61d009906a53a94abf55c8576dde36a199286b31fd32c749c2ccd680f0f;2025-10-26 15:15:53;Elárulta Magyar Péter, mik lennének a kormánya első intézkedései;https://privatbankar.hu/cikkek/kozerdeku/elarulta-magyar-peter-mit-tenne-rogton-a-kormanyra-kerulo-tisza.html?utm_source=rss&utm_medium=referral;kormánypárti;0.41;0;;https://privatbankar.hu/rss;Magyar Péter 17 óra előtt pár perccel kezdte el ünnepi beszédét a Hősök terén. A Tisza Párt elnöke zászlót lengetve lépett színpadra.;Magyar Péter 17 óra előtt pár perccel kezdte el ünnepi beszédét a Hősök terén. A Tisza Párt elnöke zászlót lengetve lépett színpadra.
26c914bf2b410d76b52e5779b7271548573b13319936d35b9e24fb625ed3edb1;2025-10-26 15:15:53;Putyin izgulhat: India után Kína is jelentősen visszafogja az orosz olajvásárlásokat;https://privatbankar.hu/cikkek/makro/putyin-izgulhat-india-utan-kina-is-jelentosen-visszafogja-az-orosz-olajvasarlasokat.html?utm_source=rss&utm_medium=referral;ellenzéki;0.183;6;;https://privatbankar.hu/rss;Kína is azonnal lépett az új amerikai szankciókra.;Kína is azonnal lépett az új amerikai szankciókra.
6e83ab60fb6ec3b2ac5d70edab5261da65dcd967bfde28d3e1b46f4b4ac62db1;2025-10-26 15:15:52;Gazdasági összeomlás és idegen űrhajó a Föld felett – itt vannak Baba Vanga jóslatai 2026-ra;https://index.hu/fomo/2025/10/26/baba-vanga-2026-joslat-gazdasagi-osszeomlas-foldonkivuliek/;ellenzéki;0.262;3;;https://index.hu/24ora/rss/;A Kelet és Nyugat közötti konfliktus is kicsúcsosodhat.;A Kelet és Nyugat közötti konfliktus is kicsúcsosodhat.
7b76942be3c42e9b0295773b8fd770d4a50d6226fefb2eed2f11005d7c2a5672;2025-10-26 15:15:52;Katonai célú használatra alakítanak át tizenegy dunántúli vasútállomást;https://index.hu/gazdasag/2025/10/26/vasutfejlesztes-katonai-logisztika-polgari-kozlekedes-vasutallomas-vasutvonal/;kormánypárti;0.083;4;;https://index.hu/24ora/rss/;Öt vasútvonalat érint a fejlesztés.;Öt vasútvonalat érint a fejlesztés.
b645f9cc9617f42a1a66ecd49826d12f00d3b6584424ef80cc18fed10a3c31b8;2025-10-26 15:15:52;Így kapnak rengetegen százezer forintokat az államtól;https://index.hu/gazdasag/2025/10/26/nyugdijpenztar-penz-visszaterites-szja-ado/;kormánypárti;0.317;4;;https://index.hu/24ora/rss/;Jelentős összegeket hagynak a magyarok parlagon heverni.;Jelentős összegeket hagynak a magyarok parlagon heverni.
602371cd3f40361423bb978eb1dce204d22ce44c5ae13e8354f9a557130ba5fb;2025-10-26 15:15:52;Tarjányi Péter: Minden ország kémkedik Brüsszelben;https://index.hu/belfold/2025/10/26/tarjanyi-peter-brusszeli-kembotrany-varhelyi-oliver/;kormánypárti;0.325;2;;https://index.hu/24ora/rss/;A biztonságpolitikai szakértő szerint legalább 3000 ember hírszerzési fedésben van.;A biztonságpolitikai szakértő szerint legalább 3000 ember hírszerzési fedésben van.
09814ab3aed3f60a065c22bcf9add93c81af66dfdbf5a96faec410f65ea7ca0f;2025-10-26 15:15:52;A kereslet elszállt, a kínálat beszorult – a magyar lakáspiac őrült iramot diktál;https://index.hu/gazdasag/2025/10/26/ingatlan-ingatlanpiac-ingatlanarak-kereslet-kinalat-elado-ingatlan-otthon-start-program/;ellenzéki;0.246;4;;https://index.hu/24ora/rss/;Az Otthon Start felrázta a piacot, a kínálati oldalnak reagálnia kell.;Az Otthon Start felrázta a piacot, a kínálati oldalnak reagálnia kell.
dc8c2904ee23a3f577c08610d8a3a3b08a94c552bfdc89d315ea696a8eda0b27;2025-10-26 15:15:52;Hivatalos: Orbán Viktort és Semjén Zsoltot is fogadja XIV. Leó pápa;https://index.hu/belfold/2025/10/26/orban-viktor-semjen-zsolt-vatikan-audencia-xiv-leo-papa/;kormánypárti;0.39;2;;https://index.hu/24ora/rss/;Egyre több információ derül ki a kormányfő olaszországi útjáról.;Egyre több információ derül ki a kormányfő olaszországi útjáról.
9ef03b2b660e2b2b3323508ce482fb782f32c55ecb7fe0af729b7825908e3469;2025-10-26 15:15:52;Hadházy közzétette a hatvanpusztai zebrák engedélykérelmeit, miután Orbán anyja tagadta a létezésüket;https://24.hu/belfold/2025/10/26/hadhazy-kozzetette-a-hatvanpusztai-zebrak-engedelykerelmeit-miutan-orban-anyja-tagadta-a-letezesuket/;kormánypárti;0.413;1;;https://24.hu/feed/;"<p>A zebrás dokumentumokat a kormány.hu oldalon lehet megnézni.</p> <p>The post <a href=""https://24.hu/belfold/2025/10/26/hadhazy-kozzetette-a-hatvanpusztai-zebrak-engedelykerelmeit-miutan-orban-anyja-tagadta-a-letezesuket/"" target=""_blank"">Hadházy közzétette a hatvanpusztai zebrák engedélykérelmeit, miután Orbán anyja tagadta a létezésüket</a> first appeared on <a href=""https://24.hu/"" target=""_b";"<p>A zebrás dokumentumokat a kormány.hu oldalon lehet megnézni.</p> <p>The post <a href=""https://24.hu/belfold/2025/10/26/hadhazy-kozzetette-a-hatvanpusztai-zebrak-engedelykerelmeit-miutan-orban-anyja-tagadta-a-letezesuket/"" target=""_blank"">Hadházy közzétette a hatvanpusztai zebrák engedélykérelmeit, miután Orbán anyja tagadta a létezésüket</a> first appeared on <a href=""https://24.hu/"" target=""_blank"">24.hu</a>.</p>"
c1460d7866dafc50c380d6c4e00472e7d36d1b6447c58ea15d65966a25a83d6f;2025-10-26 15:15:52;Marék Veronika: A háború és a dróntámadások nem férnek bele Boribon világába;https://24.hu/kultura/2025/10/26/marek-veronika-laci-es-az-oroszlan-interju-japan-kell-egy-oroszlan-visky-abel/;ellenzéki;0.546;3;;https://24.hu/feed/;"<p>Miről szabadott és miről nem szabadott gyerekkönyvet írni a szocializmusban? Hogy éli meg, mikor a politika előveszi a gyerekirodalmat? És vajon szokott-e Instagramozni? Interjú.</p> <p>The post <a href=""https://24.hu/kultura/2025/10/26/marek-veronika-laci-es-az-oroszlan-interju-japan-kell-egy-oroszlan-visky-abel/"" target=""_blank"">Marék Veronika: A háború és a dróntámadások nem férnek bele Bori";"<p>Miről szabadott és miről nem szabadott gyerekkönyvet írni a szocializmusban? Hogy éli meg, mikor a politika előveszi a gyerekirodalmat? És vajon szokott-e Instagramozni? Interjú.</p> <p>The post <a href=""https://24.hu/kultura/2025/10/26/marek-veronika-laci-es-az-oroszlan-interju-japan-kell-egy-oroszlan-visky-abel/"" target=""_blank"">Marék Veronika: A háború és a dróntámadások nem férnek bele Boribon világába</a> first appeared on <a href=""https://24.hu/"" target=""_blank"">24.hu</a>.</p>"
584a9ddc85c895f83b9336f982a3808dbe313048cf0460661871838573408cf8;2025-10-26 15:15:51;Kigurult a mátészalkai állomásról, és 4 kilométeren keresztül meg sem állt egy műszaki hibás vonat;https://telex.hu/belfold/2025/10/26/mateszalka-vonat-vezeto-nelkul;semleges;0.133;7;;https://telex.hu/rss;Az eset vasárnapra virradóra történt, senki sem sérült meg.;Az eset vasárnapra virradóra történt, senki sem sérült meg.
d742a9a80ac5dec781a1afbf1202aed2f857cc5dcd96b8343cc953738feb603a;2025-10-26 15:15:51;Még mindig kotlanak a kormányok az óraátállítás uniós eltörlésén, de felvillant némi remény;https://telex.hu/kulfold/2025/10/26/eu-oraatallitas-eltorles-visszavonas-europai-bizottsag-cafolat-europai-parlament-vita;kormánypárti;0.401;7;;https://telex.hu/rss;A magyar sajtóban korábban terjengő álhírrel szemben az Európai Bizottság nem vonta vissza a javaslatot. Újabb elemzéssel lökné előre a tagállami Tanácsot, ahol a spanyolok is piszkálják az ügyet.;A magyar sajtóban korábban terjengő álhírrel szemben az Európai Bizottság nem vonta vissza a javaslatot. Újabb elemzéssel lökné előre a tagállami Tanácsot, ahol a spanyolok is piszkálják az ügyet.
4e7c89089b956359717f4dabaa0933eb7ee56e1df7bae1936b44a9bd9f87b5d0;2025-10-26 15:15:51;A baloldali ellenzék jelöltje nyerte az írországi elnökválasztást;https://telex.hu/kulfold/2025/10/25/catherine-connolly-irorszag-elnokvalasztas;ellenzéki;0.187;0;;https://telex.hu/rss;Catherine Connolly toronymagasan verte jobboldali versenytársait.;Catherine Connolly toronymagasan verte jobboldali versenytársait.
16c3d75d162afd6be6f5c91114da760b9adb2f7dbb68a35c1f5fa097ab016d77;2025-10-26 15:15:51;A Mcdonald's exkluzív pikachus kártyái Kína-ellenes hullámot robbantottak ki Japánban;https://telex.hu/gazdasag/2025/10/25/pikachu-mcdonalds-japan;ellenzéki;0.215;3;;https://telex.hu/rss;A kínai viszonteladók felvásárolták a Happy Meal menüket, az ételpazarlás és a zűrzavar nem tetszett az embereknek.;A kínai viszonteladók felvásárolták a Happy Meal menüket, az ételpazarlás és a zűrzavar nem tetszett az embereknek.
a8c1f44ac2c9f19dcf365d8f655034c34e80cc991695bf99fb3b79dea5f1bcbc;2025-10-26 15:15:51;Tiborcz István kétmilliós kabátban álldogált a parlament előtt a Békemenet után;https://444.hu/2025/10/26/tiborcz-istvan-ketmillios-kabatban-alldogalt-a-parlament-elott-a-bekemenet-utan?utm_source=rss_feed&utm_medium=rss&utm_campaign=rss_syndication;ellenzéki;0.187;1;;https://444.hu/feed;Hadházy szerint Tiborcz kétmilliós dzsekije fájóbb, mint Szabó Zsófi hatszázezres szemüvege.;Hadházy szerint Tiborcz kétmilliós dzsekije fájóbb, mint Szabó Zsófi hatszázezres szemüvege.
17b7da4fb5f47792539238fffba33eaa371c97c4b58ae8c29873e5d8da842651;2025-10-26 15:15:51;Orbán Semjén Zsolt társaságában pápai audienciára megy;https://444.hu/2025/10/26/orban-semjen-zsolt-tarsasagaban-papai-audenciara-megy?utm_source=rss_feed&utm_medium=rss&utm_campaign=rss_syndication;kormánypárti;0.188;2;;https://444.hu/feed;Hétfőn fogadja őket XIV. Leó pápa.;Hétfőn fogadja őket XIV. Leó pápa.
2afd9ed0b9d7e16b0497f1ec5d58d509b0ee4d2b10e8cdde5634986c168a1073;2025-10-26 15:15:51;Nagy Feró: Lehet, hogy kicsit túllőttem a célon, de nincs mit visszavonjak;https://444.hu/2025/10/26/nagy-fero-lehet-hogy-kicsit-tullottem-a-celon-de-nincs-mit-visszavonjak?utm_source=rss_feed&utm_medium=rss&utm_campaign=rss_syndication;semleges;0.29;5;;https://444.hu/feed;Szerinte nem mondott olyat a Békemeneten vonulva a Szőlő utcai ügyben érintett lányokról, amit nem vállalhat. Ezért a Kossuth-díját és a díszpolgári címet sem adná vissza.;Szerinte nem mondott olyat a Békemeneten vonulva a Szőlő utcai ügyben érintett lányokról, amit nem vállalhat. Ezért a Kossuth-díját és a díszpolgári címet sem adná vissza.
8bdfd14ae8cfae7bae7d75096d4cdbd7b6f93ebc4eb5fc2d8fc9b5166824bed2;2025-10-26 15:15:51;„Nincs jelentősége az esélyek latolgatásának, itt arról van szó, hogy egy városrész elkezdte a felkelést”;https://444.hu/2025/10/26/nincs-jelentosege-az-eselyek-latolgatasanak-itt-arrol-van-szo-hogy-egy-varosresz-elkezdte-a-felkelest?utm_source=rss_feed&utm_medium=rss&utm_campaign=rss_syndication;kormánypárti;0.342;0;;https://444.hu/feed;Két rabbi szeptemberben a zsidónegyed kiválását kezdeményezte a tarhatatlan állapotokra hivatkozva, mire a Fidesz és a médiája címlapsztorikban esett neki az önkormányzatnak. A népszavazás jogilag elég nehezen kivitelezhető, de van olyan szomszédos kerület, amely nem zárkózik el teljesen az ötlettől.;Két rabbi szeptemberben a zsidónegyed kiválását kezdeményezte a tarhatatlan állapotokra hivatkozva, mire a Fidesz és a médiája címlapsztorikban esett neki az önkormányzatnak. A népszavazás jogilag elég nehezen kivitelezhető, de van olyan szomszédos kerület, amely nem zárkózik el teljesen az ötlettől.
24bb8175eff641164c756ff90ea762dacf8236a1afa873b1423a476051426276;2025-10-26 15:15:51;Orbán zártkörű országjárást hirdetett, Magyar azonnal rárepült és ugyanazokra a helyekre és napokra bárki számára nyitott fórumokat jelentett be;https://444.hu/2025/10/25/orban-zarkoru-orszagjarast-hirdetett-magyar-azonnal-rarepult-es-ugyanazokra-a-helyekre-es-napokra-barki-szamara-nyitott-forumokat-jelentett-be?utm_source=rss_feed&utm_medium=rss&utm_campaign=rss_syndication;kormánypárti;0.363;2;;https://444.hu/feed;„Ha kedve tartja, ugorjon el Ön is! Kaphat teát, meg néhány kérdést is.”;„Ha kedve tartja, ugorjon el Ön is! Kaphat teát, meg néhány kérdést is.”
d129c2ff025aaec970b05a7bcb2009b78b882b9eed83eca11f427d7e8c908c8e;2025-10-26 15:15:51;Elvennék Nagy Feró díszpolgári címét a Szőlő utcai ügyről szóló mondatai után, szerinte ettől Őrbottyán lenne szegényebb, nem ő;https://444.hu/2025/10/25/elvennek-nagy-fero-diszpolgari-cimet-a-szolo-utcai-mondatai-utan-szerinte-ettol-orbottyan-lenne-szegenyebb-nem-o?utm_source=rss_feed&utm_medium=rss&utm_campaign=rss_syndication;ellenzéki;0.367;5;;https://444.hu/feed;"A Békemeneten a zenész arról beszélt, hogy „a lányok is kerestek pénzt, mindenki jól járt, nem?"", ami miatt az egyik önkormányzati képviselő kezdeményezi Nagy Feró díszpolgári címének visszavonását.";"A Békemeneten a zenész arról beszélt, hogy „a lányok is kerestek pénzt, mindenki jól járt, nem?"", ami miatt az egyik önkormányzati képviselő kezdeményezi Nagy Feró díszpolgári címének visszavonását."
b573f38a571992a3b3bbb146502c1be13ee4b6fe41521917b39a0f376ed2f00a;2025-10-26 15:15:51;Óvóhelyre kellett mennie Kijevben a német gazdasági miniszternek;https://444.hu/2025/10/25/ovohelyre-kellett-mennie-kijevben-a-nemet-gazdasagi-miniszternek?utm_source=rss_feed&utm_medium=rss&utm_campaign=rss_syndication;kormánypárti;0.216;4;;https://444.hu/feed;Katherina Reiche utána úgy fogalmazott, hogy ami számára megrázó élmény volt, az az ukrán mindennapok része. A legutóbbi orosz légicsapásokban legkevesebb két ember halt meg.;Katherina Reiche utána úgy fogalmazott, hogy ami számára megrázó élmény volt, az az ukrán mindennapok része. A legutóbbi orosz légicsapásokban legkevesebb két ember halt meg.
8d9f08a15bcab848cdbce817b89a6ea65cd159e4a5424ee2f50323cc773c1e58;2025-10-26 15:15:51;155 millióért kínálják a legdrágább magyar panelt;https://444.hu/2025/10/25/155-millioert-kinaljak-a-legdragabb-magyar-panelt?utm_source=rss_feed&utm_medium=rss&utm_campaign=rss_syndication;kormánypárti;0.137;4;;https://444.hu/feed;Létezik álompanellakás 155 millióért és kétszintes, hétszobás panelálom 140 milliós irányáron. A legdrágább budapesti és a legolcsóbb vidéki panel között 15-szörös a négyzetméterár-különbség.;Létezik álompanellakás 155 millióért és kétszintes, hétszobás panelálom 140 milliós irányáron. A legdrágább budapesti és a legolcsóbb vidéki panel között 15-szörös a négyzetméterár-különbség.
22dfd5b4c980336d5da252db845c82a4415ac0206a31801af4f3a2feb24aaf24;2025-10-26 15:15:51;Magyar Péter a Belügyminisztérium eladásának felülvizsgálatát ígéri, ha tavasszal kormányra kerül;https://444.hu/2025/10/25/magyar-peter-a-belugyminiszterium-eladasanak-felulvizsgalatat-igeri-ha-tavasszal-kormanyra-kerul?utm_source=rss_feed&utm_medium=rss&utm_campaign=rss_syndication;kormánypárti;0.378;0;;https://444.hu/feed;„Holnap a Parlamentet is eladják?” – írta bejegyzésében a Tisza vezetője, amiben reagált a Belügyminisztérium eladásának hírére.;„Holnap a Parlamentet is eladják?” – írta bejegyzésében a Tisza vezetője, amiben reagált a Belügyminisztérium eladásának hírére.
86d917c64c4e8466d7f9c3eedeaaf3d30e654950a3d4e18bbe4a846117a33cc6;2025-10-26 15:15:51;Családi béke „luxi”: Tiborcz István 2 millió forintos dzsekiben jutott be a Parlamenthez;https://hvg.hu/elet/20251026_Csaladi-beke-luxi-Tiborcz-Istvan-2-millio-forintos-dzsekiben-jutott-be-a-Parlamentet-vedo-kordon-moge;kormánypárti;0.324;1;;https://hvg.hu/rss;A Parlament amúgy elzárt épületénél szpottolták Tiborcz Istvánt a Békemenet után. Nyilván nem olcsó ruhában.;A Parlament amúgy elzárt épületénél szpottolták Tiborcz Istvánt a Békemenet után. Nyilván nem olcsó ruhában.
920a404b0a3a807cdf0ee3d9a24eb9186e11406b2156741605f46214a903990e;2025-10-26 15:15:51;Nők elleni erőszak: alig látható az állami áldozatvédelem, az önkormányzatok próbálnak segíteni;https://hvg.hu/360/20251026_jozsefvaros-csaladon-beluli-eroszak-bantalmazott-nok-ovohely-ferencvaros-NANE-nojogi-szervezetek;kormánypárti;0.361;5;;https://hvg.hu/rss;Ferencváros után Józsefvárosban is úgy döntöttek, hogy a családon belüli és kapcsolati erőszak áldozatait segítő szolgáltatást indítanak – bár ez nem lenne kötelező önkormányzati feladat. Úgy látják ugyanis, hogy a recsegő-ropogó, kusza és tétlen állami rendszer nem védi eléggé az áldozatokat. Egyetértenek ezzel a területen régóta dolgozó nőjogi szervezetek is.;Ferencváros után Józsefvárosban is úgy döntöttek, hogy a családon belüli és kapcsolati erőszak áldozatait segítő szolgáltatást indítanak – bár ez nem lenne kötelező önkormányzati feladat. Úgy látják ugyanis, hogy a recsegő-ropogó, kusza és tétlen állami rendszer nem védi eléggé az áldozatokat. Egyetértenek ezzel a területen régóta dolgozó nőjogi szervezetek is.
b8b44383eef50f72f918fc09c4ce5dcb51e0f7d30d004e9b2b50bd31274c7855;2025-10-26 15:15:51;Puccs közkívánatra – így döntött meg újabb rezsimet a Z generációs tüntetéshullám;https://hvg.hu/360/20251026_madagaszkar_lazadas_hatalomatvetel_katonai_vednokseg_puccs_kozkivanatra_z_generacio_tuntetrshullam_CAPSAT;ellenzéki;0.35;3;;https://hvg.hu/rss;A Z generáció fiataljai kezdték a lázadást, és a katonák fejezték be a hatalomátvételt Madagaszkáron. A hadsereg nem először avatkozott be politikai válság idején, de legtöbbszőr át is adta az irányítást.;A Z generáció fiataljai kezdték a lázadást, és a katonák fejezték be a hatalomátvételt Madagaszkáron. A hadsereg nem először avatkozott be politikai válság idején, de legtöbbszőr át is adta az irányítást.
ae0d0e2ec8c7f6440cc96b7f9559adbe3431bf66aa1c208c8056da43afa8c056;2025-10-26 15:15:51;Trump megsértődött, vámot emel;https://hvg.hu/gazdasag/20251026_Trump-megsertodott-vamemelessel-sujtja-Kanadat;ellenzéki;0.124;6;;https://hvg.hu/rss;Egy vámellenes hirdetés miatt az amerikai elnök a meglévő vámokra ráemel még 10 százalékot Kanadával szemben.;Egy vámellenes hirdetés miatt az amerikai elnök a meglévő vámokra ráemel még 10 százalékot Kanadával szemben.
fb8995e1ab0e49fd12af1529907a6f3ac984cf3ec02d7ab02ebc30a63bc8bf54;2025-10-26 15:15:51;És akkor Varga Mihály elmagyarázta, miért hagyta Matolcsyékat szabadon garázdálkodni;https://hvg.hu/gazdasag/20251026_Es-akkor-Varga-Mihaly-szegenyek-mol-tiborcz-mnb-napelem-szerencsejatek;kormánypárti;0.261;1;;https://hvg.hu/rss;Furcsa dolgok történtek a szegénységi statisztikával, a jegybankelnök az elődei ügyeiről beszélt, Tiborcz Istvánnak pedig még várnia kell arra, hogy bevásárolja magát a vasúti nagy üzletbe. Ez a HVG heti gazdasági összefoglalója.;Furcsa dolgok történtek a szegénységi statisztikával, a jegybankelnök az elődei ügyeiről beszélt, Tiborcz Istvánnak pedig még várnia kell arra, hogy bevásárolja magát a vasúti nagy üzletbe. Ez a HVG heti gazdasági összefoglalója.
5ece556cf67ae8d8462cb47c0cfa031d43e33ef479d6332402e85f38533c1acb;2025-10-26 15:15:51;Semjén Zsolt elárulta, hogy a „Zsolti bácsi” ügyben mit nyomoztak ki eddig, és bocsánatkérést vár;https://hvg.hu/itthon/20251025_Semjen-Zsolt-elarulta-hogy-a-Zsolti-bacsi-ugyben-mit-nyomoztak-ki-eddig-es-bocsanatkerest-var;ellenzéki;0.447;5;;https://hvg.hu/rss;"A miniszterelnök-helyettes szerint bebizonyosodot, hogy a kormánytagokat &#8211; így őt is &#8211; „minden alapot nélkülözve, ártatlanul rágalmazták meg”.";"A miniszterelnök-helyettes szerint bebizonyosodot, hogy a kormánytagokat &#8211; így őt is &#8211; „minden alapot nélkülözve, ártatlanul rágalmazták meg”."
27ea1323c1f2574055b968939f52b02b375314d1c358473ccbd699e3501930f6;2025-10-26 15:15:51;Csata vagy mészárlás? Máig viták övezik az indián háborúkat lezáró Wounded Knee-i tragédiát;https://hvg.hu/360/20251025_wounded-knee-indian-haboruk-emlekezetpolitika-csata-meszarlas;ellenzéki;0.201;3;;https://hvg.hu/rss;Mi történt 1890. december 29-én a Wounded Knee-pataknál? Lázadó indiánok vívtak vesztes csatát az Amerikai Egyesült Államok hadseregével vagy a katonák lemészárolták az ellenállásra is képtelen indiánokat? Miért kaptak a katonák Becsület érdemérmeket a katonai szempontból nem túl jelentős akcióért és miért akarták ezt most megvonni tőlük? Ki a felelős a lakota sziúk 135 éve történt tragédiájáért?;Mi történt 1890. december 29-én a Wounded Knee-pataknál? Lázadó indiánok vívtak vesztes csatát az Amerikai Egyesült Államok hadseregével vagy a katonák lemészárolták az ellenállásra is képtelen indiánokat? Miért kaptak a katonák Becsület érdemérmeket a katonai szempontból nem túl jelentős akcióért és miért akarták ezt most megvonni tőlük? Ki a felelős a lakota sziúk 135 éve történt tragédiájáért?
ad04db374d8e06cbeaec3c34e0911ba59ffeda792722fedb480b46b52571b209;2025-10-26 15:15:51;Kamala Harris és Donald Trump is fontolgatják, hogy 2028-ban is elinduljanak az elnökválasztáson;https://hvg.hu/vilag/20251025_Kamala-Harris-Donald-Trump-amerikai-elnokvalasztas-2028-Steve-Bannon;ellenzéki;0.232;6;;https://hvg.hu/rss;A volt demokrata elnökjelölt maga beszélt a lehetőségről, Trump indulását pedig korábbi tanácsadója, Steve Bannon lengette be.;A volt demokrata elnökjelölt maga beszélt a lehetőségről, Trump indulását pedig korábbi tanácsadója, Steve Bannon lengette be.
f56f8b4f4301184ce3cd7af74f22cfd872c89834a46fd288c8de4d7825834b6e;2025-10-26 15:15:51;Nagy Feró a díszpolgári cím elvételéről: „És akkor mi van? A város lesz szegényebb, nem én.”;https://hvg.hu/elet/20251025_Nagy-Fero-diszpolgari-cim-reakcio-Orbottyan-Szolo-utca-ebx;ellenzéki;0.459;5;;https://hvg.hu/rss;A zenész őrbottyáni díszpolgári címét a Szőlő utcai botrányról tett kijelentései miatt venné el egy önkormányzati képviselő.;A zenész őrbottyáni díszpolgári címét a Szőlő utcai botrányról tett kijelentései miatt venné el egy önkormányzati képviselő.
a3692def1bf8ba455362525591314c9406a9cac63afadc6678d10cbbdefe98e6;2025-10-26 15:15:51;Felmérés: A magyarok fele szerint a kormánynak is felelőssége van a Szőlő utcai ügyben;https://hvg.hu/itthon/20251025_kormany-felelosseg-Szolo-utca-Jambor-Andras-21-kutatokozpont;kormánypárti;0.61;0;;https://hvg.hu/rss;Jámbor András rendelt egy felmérést a 21 Kutatóközponttól. Eszerint még a Fidesz szavazók 10 százaléka is elismeri, hogy a kormánynak van felelőssége az ügyben.;Jámbor András rendelt egy felmérést a 21 Kutatóközponttól. Eszerint még a Fidesz szavazók 10 százaléka is elismeri, hogy a kormánynak van felelőssége az ügyben.
